<?xml version="1.0" encoding="UTF-8"?>
<schema xmlns="http://www.w3.org/2001/XMLSchema" targetNamespace="http://angelis.com/player_class_skills"
    xmlns:xsd="http://angelis.com/player_class_skills" xmlns:base="http://angelis.com/base" elementFormDefault="qualified"
>
    <!-- IMPORTS -->
    <import schemaLocation="base.xsd" namespace="http://angelis.com/base" />
    
    <!-- TYPES -->
    <complexType name="PlayerClassSkillType">
        <sequence>
            <element name="skill" type="base:SkillType" maxOccurs="unbounded"/>
        </sequence>
        <attribute name="targetClass" type="base:ClassType"/>
    </complexType>
    <complexType name="PlayerClassSkillsType">
        <sequence>
            <element name="player_class_skill" type="xsd:PlayerClassSkillType" minOccurs="0" maxOccurs="unbounded" />
        </sequence>
    </complexType>
    
    <!-- CONTENT -->
    <element name="player_class_skills" type="xsd:PlayerClassSkillsType" />
</schema>